<?xml version="1.0" encoding="UTF-8"?>
<?xml-stylesheet type="text/xsl" href="../XSLT/infermier.xsl"?>
<Cabinet xmlns="http://www.univ-grenoble-alpes.fr/l3miage/medical"
         xmlns:xsi="http://www.w3.org/2001/XMLSchema-instance"
         xsi:schemaLocation="http://www.univ-grenoble-alpes.fr/l3miage/medical ../XSD/cabinet.xsd">
    
    
  <!-- Informations du Cabinet -->
      <nom>Cabinet Soins à Grenoble</nom>
      <adresse>
        <etage>1</etage>
        <numero>45</numero>
        <rue>Rue de la Santé</rue>
        <ville>Grenoble</ville>
        <codePostal>38000</codePostal>
      </adresse>

    <!-- Liste des Infirmiers -->
    <infirmiers>
                <infirmier id="001">
                  <nom>Fréchie</nom>
                  <prenom>Sarah</prenom>
                  <photo>sarah.png</photo>
                </infirmier>
      
                <infirmier id="002">
                  <nom>Sidcé</nom>
                  <prenom>Sophie</prenom>
                  <photo>sophie.jpg</photo>
                </infirmier>
      
                <infirmier id="003">
                  <nom>Ochou</nom>
                  <prenom>Paul</prenom>
                  <photo>paul.png</photo>
                </infirmier>
    </infirmiers>

  <!-- Liste des Patients -->
  <patients>
            <patient>
              <nom>Orouge</nom>
              <prenom>Elvire</prenom>
              <sexe>F</sexe>
              <naissance>1982-03-08</naissance>
              <numero>282030837001234</numero>
              <adresse>
                      <rue>Rond-Point de la Croix de Vie</rue>
                      <ville>La Tronche</ville>
                      <codePostal>38700</codePostal>
              </adresse>
                      <visites>
                        <Visite>
                          <date>2015-12-08</date>
                          <intervenant>001</intervenant>
                          <actes>
                            <acte id="201" type="pc" cle="AMI" coef="2.5">
                              Pansement de brûlure étendue
                            </acte>
                          </actes>
                        </Visite>
                      </visites>
            </patient>

            <patient>
            <nom>Pien</nom>
            <prenom>Oscare</prenom>
            <sexe>M</sexe>
            <naissance>1975-03-25</naissance>
            <numero>175032538001234</numero>
            <adresse>
              <rue>Rue Casimir Brenier</rue>
              <ville>Grenoble</ville>
              <codePostal>38000</codePostal>
            </adresse>
                        <visites>
                              <Visite>
                                <date>2015-12-08</date>
                                <intervenant>002</intervenant>
                                <actes>
                                          <acte id="202" type="pi" cle="AMI" coef="1.5">
                                            Ponction veineuse directe
                                          </acte>
                                          <acte id="203" type="pi" cle="AMI" coef="3.0">
                                            Injection intraveineuse d'antalgiques
                                          </acte>
                                </actes>
                              </Visite>
                        </visites>
              </patient>

              <patient>
                
                      <nom>Kapoëtla</nom>
                      <prenom>Xavier</prenom>
                      <sexe>M</sexe>
                      <naissance>2011-08-02</naissance>
                      <numero>111080237001234</numero>
                      <adresse>
                          <numero> 25 </numero>
                        <rue>Rue des Martyrs</rue>
                        <ville>Grenoble</ville>
                        <codePostal>38042</codePostal>
                      </adresse>
                          <visites>
                                    <Visite>
                                      <date>2015-12-08</date>
                                      <intervenant>003</intervenant>
                                            <actes>
                                                      <acte id="204" type="pi" cle="AMI" coef="4.0">
                                                        Injection de plusieurs allergènes pour désensibilisation
                                                      </acte>
                                            </actes>
                                    </Visite>
                          </visites>
                
              </patient>

              <patient>
                        <nom>Alécole</nom>
                        <prenom>Yvon</prenom>
                        <sexe>M</sexe>
                        <naissance>1998-08-22</naissance>
                        <numero>198082205545852</numero>
                        <adresse>
                                  <etage>6</etage>
                                  <numero>50</numero>
                                  <rue>avenue Félix Viallet</rue>
                                  <ville>Grenoble</ville>
                                  <codePostal>38031</codePostal>
                        </adresse>
                        <visites>
                                  <Visite>
                                    <date>2015-12-08</date>
                                    <intervenant>001</intervenant>
                                            <actes>
                                                    <acte id="109" type="pi" cle="AMI" coef="1.0">
                                                            Injection sous-cutanée.
                                                    </acte>
                                            </actes>
                                  </Visite>
                        </visites>
              </patient>


  </patients>
  
  
  
</Cabinet>
